_id,text,context,qualifier,laterality,presence,presentation,experiencer,stage,timeSpent,conceptIds,snomedTimeSpent
67f3d4c2a8eceb0329bcefec,CT Neck,Sequential axial CT images were obtained from the base of the brain to the thoracic inlet following the uneventful administration of 100 CC Optiray 320 intravenous contrast.,Test Results,N/A,Confirmed,N/A,Patient,Current,14222,169068008,9305
67f3d4e8a8eceb0329bcefee,within normal limits,The oropharynx and nasopharynx are within normal limits.,Test Results,N/A,Confirmed,N/A,Patient,Current,13011,,0
67f3d514a8eceb0329bceff0,normal,The epiglottis and epiglottic folds are normal.,Test Results,N/A,Confirmed,N/A,Patient,Current,34228,,0
67f3d524a8eceb0329bceff2,unremarkable,Scans through the base of the brain are unremarkable.,Test Results,N/A,Confirmed,N/A,Patient,Current,7066,,0
67f3d572a8eceb0329bceff4,enhance homogenously,"The thyroid, submandibular, and parotid glands enhance homogenously",Test Results,N/A,Confirmed,N/A,Patient,Current,9569,274621000,24914
67f3d58fa8eceb0329bceff6,intact,The vascular and osseous structures in the neck are intact,Test Results,N/A,Confirmed,N/A,Patient,Current,14381,,0
67f3d624a8eceb0329bceff8,no lymphadenopathy,There is no lymphadenopathy.,Test Results,N/A,Confirmed,N/A,Patient,Current,27010,,0
67f3d634a8eceb0329bceffa,clear,The visualized lung apices are clear.,Test Results,N/A,Confirmed,N/A,Patient,Current,7646,,0
67f3d648a8eceb0329bceffc,No acute abnormalities,"Scans through the base of the brain are unremarkable. The oropharynx and nasopharynx are within normal limits. The airway is patent. The epiglottis and epiglottic folds are normal. The thyroid, submandibular, and parotid glands enhance homogenously. The vascular and osseous structures in the neck are intact. There is no lymphadenopathy. The visualized lung apices are clear.",Test Results,N/A,Confirmed,N/A,Patient,Current,7517,,0
