_id,text,context,qualifier,laterality,presence,presentation,experiencer,stage,timeSpent,conceptIds,snomedTimeSpent
67be2159a8eceb0329bc9c51,Laryngoscopy ,Microsuspension direct laryngoscopy with biopsy.,Procedures,N/A,N/A,Primary,Patient,Current,15018,28760000,7104
67be216ca8eceb0329bc9c53,Biopsy,Microsuspension direct laryngoscopy with biopsy.,Test Results,N/A,N/A,Primary,Patient,Current,11000,86273004,3431
67be218aa8eceb0329bc9c55,Fullness in base of the tongue,Fullness in right base of the tongue and chronic right ear otalgia. ,Signs,Right,Confirmed,Primary,Patient,Current,22304,47975008;126779009,13051
67be219fa8eceb0329bc9c57,Chronic otalgia,Fullness in right base of the tongue and chronic right ear otalgia. ,Symptoms,Right,Suspected,Primary,Patient,Current,19847,301354004;12336008,10850
67be21f1a8eceb0329bc9c59,Suspicious lesion in pyriform sinus ,"Again in the right piriform sinus, there was noted to be studding along the right lateral wall of the piriform sinus.",Signs,Right,Confirmed,Primary,Patient,Current,22104,126688006;6217003,16683
67be2211a8eceb0329bc9c5b,No neck masses,No neck masses were identified.,Signs,Bilateral,Negated,Primary,Patient,Current,23987,840674001,15818
