_id,text,context,qualifier,laterality,presence,presentation,experiencer,stage,timeSpent,conceptIds,snomedTimeSpent
67be9fa0a8eceb0329bc9eaa,Tonsillectomy and adenoidectomy,Tonsillectomy and adenoidectomy.,Procedures,N/A,Confirmed,Primary,Patient,Current,20955,28913000,32708
67be9fbca8eceb0329bc9eac,Adenotonsillar hypertrophy ,Obstructive adenotonsillar hypertrophy with chronic recurrent pharyngitis.  ,Diagnosis,N/A,Confirmed,Primary,Patient,Current,20105,66622006,5066
67bea004a8eceb0329bc9eae,Local anaesthetic,"The tonsillar fossa was then once again hemostased with suction cautery, injected with 0.5% ropivacaine with 1:100,000 adrenal solution and then closed with 2-0 Monocryl on an SH needle. ",Treatments,N/A,Confirmed,Primary,Patient,Current,18653,373477003,7833
67c0398da8eceb0329bc9f14,Difficulty swallowing ,"We were requested to evaluate the patient for complaints of enlarged tonsils, which cause difficulty swallowing, recurrent pharyngitis, and sleep-induced respiratory disturbance. ",Symptoms,N/A,N/A,Primary,Patient,Current,18015,288939007;288945004;8801000175101;162025006;898751000000102,13737
67c039a6a8eceb0329bc9f16,Recurrent pharyngitis,"We were requested to evaluate the patient for complaints of enlarged tonsils, which cause difficulty swallowing, recurrent pharyngitis, and sleep-induced respiratory disturbance. ",Diagnosis,N/A,Suspected,N/A,Patient,Current,23150,405737000,15229
67c039bba8eceb0329bc9f18,Sleep-induced respiratory disturbance,"We were requested to evaluate the patient for complaints of enlarged tonsils, which cause difficulty swallowing, recurrent pharyngitis, and sleep-induced respiratory disturbance. ",Diagnosis,N/A,Suspected,N/A,Patient,Current,20063,230499002,23183
67c03a32a8eceb0329bc9f42,Tonsil specimen,Specimens produced were right and left tonsils. ,Test Results,Bilateral,Confirmed,N/A,Patient,Post-,25966,430222001;309192007,7617
