_id,text,context,qualifier,laterality,presence,presentation,experiencer,stage,timeSpent,conceptIds,snomedTimeSpent
680a3c8da8eceb0329bd0ec6,Viral upper respiratory infection (URI) with sinus and eustachian congestion,Viral upper respiratory infection (URI) with sinus and eustachian congestion. Patient is a 14-year-old white female who presents with her mother complaining of a four-day history of cold symptoms consisting of nasal congestion and left ear pain.   (Medical Transcription Sample Report),Diagnosis,N/A,N/A,N/A,Patient,N/A,6310,54150009;82297005,28994
680a3c99a8eceb0329bd0ec8,14-year-old white female,Patient is a 14-year-old white female who presents with her mother complaining of a four-day history of cold symptoms consisting of nasal congestion and left ear pain,Socio-demographics,N/A,N/A,N/A,N/A,N/A,3059,,0
680a3ca5a8eceb0329bd0eca,four-day history of cold symptoms consisting of nasal congestion and left ear pain,Patient is a 14-year-old white female who presents with her mother complaining of a four-day history of cold symptoms consisting of nasal congestion and left ear pain.,Symptoms,N/A,N/A,N/A,N/A,N/A,2151,,0
680a3cb6a8eceb0329bd0ecc,"dry cough and a fever as high as 100,","She has had a dry cough and a fever as high as 100, but this has not been since the first day",Symptoms,N/A,N/A,N/A,Patient,N/A,4740,,0
680a3ccba8eceb0329bd0ece,The patient does note some pressure in her sinuses.,The patient does note some pressure in her sinuses. She denies any skin rash.,Signs,N/A,N/A,N/A,Patient,N/A,17679,1264052006,14475
680a3ce2a8eceb0329bd0ed0,Sinuses do show some mild tenderness to percussion,Both TMs are easily visualized and are clear with good light reflex and no erythema. Sinuses do show some mild tenderness to percussion.,Signs,N/A,N/A,N/A,Patient,N/A,3617,,0
680a3cfea8eceb0329bd0ed2,Advil Cold & Sinus for the next three to five days,I did educate the patient about her problem and urged her to switch to Advil Cold & Sinus for the next three to five days for better control of her sinus and eustachian discomfort.,Treatments,N/A,N/A,N/A,Patient,N/A,3640,,0
